{
  "amendment_v2": {
    "audit_id": "operator-cap-M0500-63e96c3afbee45a9",
    "cap_cumulative_M": 500,
    "committed_at_utc": "2026-08-27T22:01:09.009723Z",
    "declared_at_utc": "2026-08-27T22:01:08.035616Z",
    "envelope": {
      "artifact": {
        "bytes": 5900,
        "path": "results/budget_toxicity_calibration_operator_cap_v2__launch_364a65e046c83acf__20260827/budget_toxicity_calibration_operator_cap_M0500_amendment.json",
        "sha256": "3097380d0f3fe661807e162c99a1b83583d1c2ae2ca1dcc31e400e1c47455485"
      },
      "commit": {
        "bytes": 698,
        "path": "results/budget_toxicity_calibration_operator_cap_v2__launch_364a65e046c83acf__20260827/budget_toxicity_calibration_operator_cap_M0500_amendment.json.commit.json",
        "sha256": "1e0db4c035327553b3e1fe97822acb2c01fe10b21be9743a243a56dbc6c710d6"
      },
      "metadata": {
        "bytes": 885,
        "path": "results/budget_toxicity_calibration_operator_cap_v2__launch_364a65e046c83acf__20260827/budget_toxicity_calibration_operator_cap_M0500_amendment.json.metadata.json",
        "sha256": "d56c68e4d36516502abfb07d80f93037525a7fca91ad3a62a4a084a62021319e"
      }
    },
    "launch_fingerprint": "364a65e046c83acf5458885e8b07e2cb3de441c5ba01f0a1d02e6f59f6d3e0a5"
  },
  "analysis_envelope": {
    "artifact_count": 16,
    "commit_status": "COMMITTED_AUTHENTICATED_BUDGET_TOXICITY_CALIBRATION_ANALYSIS",
    "file_bundle_sha256": "79286f1fcc004e12557cf5682a6e6f00712d490e7b3024b05caf4d51e7084c7e",
    "file_count": 34,
    "files": {
      "budget_toxicity_calibration_analysis.commit.json": {
        "bytes": 319,
        "path": "results/budget_toxicity_calibration_analysis/budget_toxicity_calibration_analysis.commit.json",
        "sha256": "83ed20118b1ad9bdf37c35db809317d625c8fcd66e0eedc909d44b8527d8f20f"
      },
      "budget_toxicity_calibration_analysis.metadata.json": {
        "bytes": 66110,
        "path": "results/budget_toxicity_calibration_analysis/budget_toxicity_calibration_analysis.metadata.json",
        "sha256": "9c1d2ffffa347c116583e6e4d0ab75440e01236a065d2b87003b16c0dddb8a9e"
      },
      "budget_toxicity_calibration_baseline_identity.json": {
        "bytes": 4748,
        "path": "results/budget_toxicity_calibration_analysis/budget_toxicity_calibration_baseline_identity.json",
        "sha256": "c796ab602b95a6033a80e6d3361fb49ea7e9e5034188d517561ffd23b8f62450"
      },
      "budget_toxicity_calibration_baseline_identity.json.metadata.json": {
        "bytes": 61365,
        "path": "results/budget_toxicity_calibration_analysis/budget_toxicity_calibration_baseline_identity.json.metadata.json",
        "sha256": "4c6d2f20b71241d17c43c224603bd2d98dd7715a33d57ce52562634b2a70a663"
      },
      "budget_toxicity_calibration_primary.csv": {
        "bytes": 40533,
        "path": "results/budget_toxicity_calibration_analysis/budget_toxicity_calibration_primary.csv",
        "sha256": "fc877fcb54a62e8f78b824b00d29cb491ec44771ec9f9191a0e96f5e17f89e6a"
      },
      "budget_toxicity_calibration_primary.csv.metadata.json": {
        "bytes": 61354,
        "path": "results/budget_toxicity_calibration_analysis/budget_toxicity_calibration_primary.csv.metadata.json",
        "sha256": "a3b5f4704e8f8961b507019d0c70bff625421a00173401d0c4b75321f6f977cb"
      },
      "budget_toxicity_calibration_primary.json": {
        "bytes": 147856,
        "path": "results/budget_toxicity_calibration_analysis/budget_toxicity_calibration_primary.json",
        "sha256": "81cd4438ac97cc824a15eaa3eb6c581744f4cf074e2fa363ac31643cdcaf91c2"
      },
      "budget_toxicity_calibration_primary.json.metadata.json": {
        "bytes": 61357,
        "path": "results/budget_toxicity_calibration_analysis/budget_toxicity_calibration_primary.json.metadata.json",
        "sha256": "e851c9a5b5f4ba077d92036b3dfbb0eb6c6db8fa09bf42f357f1fc06bfed33ed"
      },
      "budget_toxicity_calibration_primary.tex": {
        "bytes": 21381,
        "path": "results/budget_toxicity_calibration_analysis/budget_toxicity_calibration_primary.tex",
        "sha256": "1307db378ec21ebc9bac19ce163fcb715222534e32b39e99b00061b1a8c1efcd"
      },
      "budget_toxicity_calibration_primary.tex.metadata.json": {
        "bytes": 61354,
        "path": "results/budget_toxicity_calibration_analysis/budget_toxicity_calibration_primary.tex.metadata.json",
        "sha256": "a9fbbbda0a37f2feef5605cdf229c4a31f6f723f2b4803fd3eaf1ac26af56f6d"
      },
      "budget_toxicity_calibration_secondary.csv": {
        "bytes": 382533,
        "path": "results/budget_toxicity_calibration_analysis/budget_toxicity_calibration_secondary.csv",
        "sha256": "fd394361248e3731937c7fb392ec1ad07e23a61ff59cf7c86dc0dc943fbf4af9"
      },
      "budget_toxicity_calibration_secondary.csv.metadata.json": {
        "bytes": 61361,
        "path": "results/budget_toxicity_calibration_analysis/budget_toxicity_calibration_secondary.csv.metadata.json",
        "sha256": "88a06aca6c290940606209c281a691e8e1631edbf3caddc15d90fecc76d26e50"
      },
      "budget_toxicity_calibration_secondary.json": {
        "bytes": 1208690,
        "path": "results/budget_toxicity_calibration_analysis/budget_toxicity_calibration_secondary.json",
        "sha256": "76e21974fad82ec53e085a7f1fba9c0bf3b13a599b3e8f02a7e81595549005fe"
      },
      "budget_toxicity_calibration_secondary.json.metadata.json": {
        "bytes": 61364,
        "path": "results/budget_toxicity_calibration_analysis/budget_toxicity_calibration_secondary.json.metadata.json",
        "sha256": "e3588f507717bfc25bc97c56f5b2dd3d7a85da4ace0eee125253b9aa415c753f"
      },
      "budget_toxicity_calibration_secondary.tex": {
        "bytes": 21181,
        "path": "results/budget_toxicity_calibration_analysis/budget_toxicity_calibration_secondary.tex",
        "sha256": "297003458b6d4a2b5dc1b813bb92b69c495ebe7f914903652cf8c739a6f5f263"
      },
      "budget_toxicity_calibration_secondary.tex.metadata.json": {
        "bytes": 61360,
        "path": "results/budget_toxicity_calibration_analysis/budget_toxicity_calibration_secondary.tex.metadata.json",
        "sha256": "8dbc1eff880ee54a3baf3b2429598b15f8cc7d1bcfca39147f18cc6f559e95c0"
      },
      "figure_calibration_acquisition_tradeoff.eps": {
        "bytes": 132678,
        "path": "results/budget_toxicity_calibration_analysis/figure_calibration_acquisition_tradeoff.eps",
        "sha256": "5cc12cc2b05bfa081c3d1011d70a0e152c3e0fed332a3ebceb9bc7d0957b683d"
      },
      "figure_calibration_acquisition_tradeoff.eps.metadata.json": {
        "bytes": 57403,
        "path": "results/budget_toxicity_calibration_analysis/figure_calibration_acquisition_tradeoff.eps.metadata.json",
        "sha256": "73ddd54c9b2f0c7ba4d7c3aa1548ad4e08fae2b7e98f0fc61e9b0d293b34fa81"
      },
      "figure_calibration_acquisition_tradeoff.pdf": {
        "bytes": 32170,
        "path": "results/budget_toxicity_calibration_analysis/figure_calibration_acquisition_tradeoff.pdf",
        "sha256": "b8522f10dad01d552508a3464afa8e77c5dc2666a0bda61e4d92605f531a59ab"
      },
      "figure_calibration_acquisition_tradeoff.pdf.metadata.json": {
        "bytes": 57402,
        "path": "results/budget_toxicity_calibration_analysis/figure_calibration_acquisition_tradeoff.pdf.metadata.json",
        "sha256": "9735a8b2392e1f22002eba1efd9b15d3a688df842fbacc2287c963f5edaf2c20"
      },
      "figure_calibration_acquisition_tradeoff.png": {
        "bytes": 825435,
        "path": "results/budget_toxicity_calibration_analysis/figure_calibration_acquisition_tradeoff.png",
        "sha256": "f8c3d75339e367dc14b13d213730be4475d0fa4fb4f2338931817debb2a39bc7"
      },
      "figure_calibration_acquisition_tradeoff.png.metadata.json": {
        "bytes": 57403,
        "path": "results/budget_toxicity_calibration_analysis/figure_calibration_acquisition_tradeoff.png.metadata.json",
        "sha256": "e88ab4ef8851c875509b943e0db2b718567ef282ed70bb03eb6eaae7676cc187"
      },
      "figure_calibration_penalties.eps": {
        "bytes": 130148,
        "path": "results/budget_toxicity_calibration_analysis/figure_calibration_penalties.eps",
        "sha256": "e96c2b6673cf54391f66265c09036babe82362c158a026021e1187cc5b805e94"
      },
      "figure_calibration_penalties.eps.metadata.json": {
        "bytes": 57399,
        "path": "results/budget_toxicity_calibration_analysis/figure_calibration_penalties.eps.metadata.json",
        "sha256": "d279744891d711c121161ba3b8a0b7cc08a9b217c3b5b2383c84c9f36cd5755d"
      },
      "figure_calibration_penalties.pdf": {
        "bytes": 32955,
        "path": "results/budget_toxicity_calibration_analysis/figure_calibration_penalties.pdf",
        "sha256": "6503073718ebcdeb91487aef7a6cee6423c9b531110900b0dcb0527f8a41e213"
      },
      "figure_calibration_penalties.pdf.metadata.json": {
        "bytes": 57398,
        "path": "results/budget_toxicity_calibration_analysis/figure_calibration_penalties.pdf.metadata.json",
        "sha256": "ee810f3d8e83ad98936d00f72bc2d7e354fa84028c53dbd7d18207541b56ba08"
      },
      "figure_calibration_penalties.png": {
        "bytes": 730179,
        "path": "results/budget_toxicity_calibration_analysis/figure_calibration_penalties.png",
        "sha256": "bc02f55b8fc7b6c12fca277adba421df042f087f6acdde8814cd7d99b4592334"
      },
      "figure_calibration_penalties.png.metadata.json": {
        "bytes": 57399,
        "path": "results/budget_toxicity_calibration_analysis/figure_calibration_penalties.png.metadata.json",
        "sha256": "638306bb16035ad51c36033bd1b503bedc5c16660d49519a869d435bbcae3037"
      },
      "figure_gate_failure_recovery_profiles.eps": {
        "bytes": 141415,
        "path": "results/budget_toxicity_calibration_analysis/figure_gate_failure_recovery_profiles.eps",
        "sha256": "0e5a39d90245058f40ba3a4f66cd15a6b680473248b15096e23066171e2806f0"
      },
      "figure_gate_failure_recovery_profiles.eps.metadata.json": {